<?xml version="1.0" encoding="UTF-8"?>
<esor:XAIP xmlns:esor="http://www.bsi.bund.de/tr-esor/xaip" xmlns:ds="http://www.w3.org/2000/09/xmldsig#" xmlns:dss="urn:oasis:names:tc:dss:1.0:core:schema" 
  xmlns:xsi="http://www.w3.org/2001/XMLSchema-instance" xsi:schemaLocation="http://www.bsi.bund.de/tr-esor/xaip file:///C:/Projects/BSI/Proc-XAIPSigVal/60.Abnahme/220106-cli/211130-TR-ESOR-Schema-1.3.0/tr-esor-xaip-v1.3.xsd" XAIPVersion="1.3.0">
	<esor:packageHeader packageID="x373f4e59-69dc-4a77-9ea6-75e91a74bfc4">
		<esor:AOID>40387ca1-4497-40fa-acfa-9976132b1001</esor:AOID>
		<esor:versionManifest VersionID="V001">
			<esor:preservationInfo>
				<esor:retentionPeriod>2100-01-01+01:00</esor:retentionPeriod>
			</esor:preservationInfo>
			<esor:submissionInfo>
				<esor:clientID>remotebean_esor12</esor:clientID>
				<esor:submissionTime>2017-02-10T14:43:26.898+01:00</esor:submissionTime>
			</esor:submissionInfo>
			<esor:packageInfoUnit packageUnitID="_idx_DO-01_V001">
				<esor:protectedObjectPointer>DO-01</esor:protectedObjectPointer>
				<esor:unprotectedObjectPointer>CR-01</esor:unprotectedObjectPointer>
			</esor:packageInfoUnit>
		</esor:versionManifest>
		<ds:CanonicalizationMethod xmlns:ds="http://www.w3.org/2000/09/xmldsig#" Algorithm="http://www.w3.org/TR/2001/REC-xml-c14n-20010315"/>
	</esor:packageHeader>
	<esor:dataObjectsSection>
		<esor:dataObject dataObjectID="DO-01">
			<esor:binaryData>DQpCdW5kZXNhbXQgZvxyIFNpY2hlcmhlaXQgaW4gZGVyIEluZm9ybWF0aW9uc3RlY2huaWsgKEJTSSkNCg0KVGVzdGRva3VtZW50Lg0KDQoyMDE5</esor:binaryData>
		</esor:dataObject>
	</esor:dataObjectsSection>
	<esor:credentialsSection>
		<esor:credential credentialID="CR-01" relatedObjects="DO-01">
			<dss:SignatureObject>
				<dss:Base64Signature>MIAGCSqGSIb3DQEHAqCAMIACAQExDzANBglghkgBZQMEAgEFADCABgkqhkiG9w0BBwEAAKCAMIIIbDCCBiSgAwIBAgIQFlis0jU1NisR2UdUuXFHkDA9BgkqhkiG9w0BAQowMKANMAsGCWCGSAFlAwQCA6EaMBgGCSqGSIb3DQEBCDALBglghkgBZQMEAgOiAwIBQDBbMQswCQYDVQQGEwJERTEVMBMGA1UEChMMRC1UcnVzdCBHbWJIMRwwGgYDVQQDExNELVRSVVNUIENBIDMtMSAyMDE2MRcwFQYDVQRhEw5OVFJERS1IUkI3NDM0NjAeFw0xODAxMDkwNTQyMTFaFw0yMTAxMTkwNTQyMTFaMFsxCzAJBgNVBAYTAkRFMS0wKwYDVQQDDCRJbnRlcm9wZXJhYmlsaXTDpHRzdGVzdGVyIFRSLUVTT1I6UE4xHTAbBgNVBAUTFERUUldNNzMwMjg3MTE1NTUyMzIyMIIBIjANBgkqhkiG9w0BAQEFAAOCAQ8AMIIBCgKCAQEAujqTuHyYdclpnhNj1viAc7xfZKNfYgci7b474u6cxF9SNtAps1ROVkfO9epgexeiHuOyd4E9A3DP5G/PTrZXmB2u2ybfek4lotZ9TbDa/oi4tdeHiekGTFVPBAmgqBqnFoHR11rAZu1Lx3SfSvRvRpyXqezbTo7EK+2ZOuGJvydUOgFwyymflfEx7NyoRUjcrOR4utLFZAHd2ipuRwNQkFco2P21NMomd8/5/CNZeHoFH1+BMLCal1ICVWfx43hfiXfL2M8jEBoo3wLn1OvcHl9jv4tRCBkQ92Kp/ysq2jqeeJNqZSrQiK3E3f46YIX+J1IqA1ZFlOc2NHe0vAsEYQIDAQABo4IDyjCCA8YwHwYDVR0jBBgwFoAU++3frUvwJbXSet2fmh0vbQlQIccwgeQGCCsGAQUFBwEDBIHXMIHUMBUGBgQAjkYBAjALEwNFVVICAQACAQAwCAYGBACORgEBMAgGBgQAjkYBBDCBkQYGBACORgEFMIGGMEEWO2h0dHA6Ly93d3cuZC10cnVzdC5uZXQvaW50ZXJuZXQvZmlsZXMvRC1UUlVTVF9QS0lfRFNfREUucGRmEwJERTBBFjtodHRwOi8vd3d3LmQtdHJ1c3QubmV0L2ludGVybmV0L2ZpbGVzL0QtVFJVU1RfUEtJX0RTX0VOLnBkZhMCRU4wEwYGBACORgEGMAkGBwQAjkYBBgEwgfoGCCsGAQUFBwEBBIHtMIHqMDMGCCsGAQUFBzABhidodHRwOi8vZHRyLWNhLTMtMS0yMDE2Lm9jc3AuZC10cnVzdC5uZXQwQgYIKwYBBQUHMAKGNmh0dHA6Ly93d3cuZC10cnVzdC5uZXQvY2dpLWJpbi9ELVRSVVNUX0NBXzMtMV8yMDE2LmNydDBvBggrBgEFBQcwAoZjbGRhcDovL2RpcmVjdG9yeS5kLXRydXN0Lm5ldC9DTj1ELVRSVVNUJTIwQ0ElMjAzLTElMjAyMDE2LE89RC1UcnVzdCUyMEdtYkgsQz1ERT9jQUNlcnRpZmljYXRlP2Jhc2U/MHEGA1UdIARqMGgwCQYHBACL7EABAjBbBgsrBgEEAaU0AoEWATBMMEoGCCsGAQUFBwIBFj5odHRwOi8vd3d3LmQtdHJ1c3QubmV0L2ludGVybmV0L2ZpbGVzL0QtVFJVU1RfUm9vdF9QS0lfQ1BTLnBkZjCB8AYDVR0fBIHoMIHlMIHioIHfoIHchmlsZGFwOi8vZGlyZWN0b3J5LmQtdHJ1c3QubmV0L0NOPUQtVFJVU1QlMjBDQSUyMDMtMSUyMDIwMTYsTz1ELVRydXN0JTIwR21iSCxDPURFP2NlcnRpZmljYXRlcmV2b2NhdGlvbmxpc3SGMmh0dHA6Ly9jcmwuZC10cnVzdC5uZXQvY3JsL2QtdHJ1c3RfY2FfMy0xXzIwMTYuY3JshjtodHRwOi8vY2RuLmQtdHJ1c3QtY2xvdWRjcmwubmV0L2NybC9kLXRydXN0X2NhXzMtMV8yMDE2LmNybDAdBgNVHQ4EFgQUz3ctW1D1HxL6hDzDpFu7Bk7XCrkwDgYDVR0PAQH/BAQDAgZAMCoGBSskCAMIBCEMH0ludGVyb3BlcmFiaWxpdMOkdHN0ZXN0IFRSLUVTT1IwPQYJKoZIhvcNAQEKMDCgDTALBglghkgBZQMEAgOhGjAYBgkqhkiG9w0BAQgwCwYJYIZIAWUDBAIDogMCAUADggIBAE/9cfGQ7jMMEak/+9c3pbIolCulqVArO5fqmIR+7NlxT1cK6XpmNuFO9sZgd9TjUoFYmoyzolUPqc8ydrUQ/FC0sBVrRmo3Lbtx2grc8DKyoo06lqkAKI3rYsZ6nOaLh4OA2ilNLWNscxais9RRjvgXZfemsqT4L2GKz6W2DfmkgG757HnWvKuzvWI+LKPawglbFSOB8P6GrF/XyVtLSTWx+ka+Bdb1QsWJOD1Z0vHFiW4eclfry4uAic8QbeDfh3X65eSiymv2LQBbNk4TxTKhDmtOlLYqovfkFYirku3rWkNsD1pjm/sjKUmtTetePo53+dVAbfkhpdBQ4LtHvodBo5IH5AI3GfY0DLDrF80Xs5xj6YpU4P8yKe6SFfM1eDapTU/cXgea17vkuEoT+YVJcSj+sUYedqEPJJXnyPFpB3L4KhhDqoEz9NPswjx1vZ06TIjichjXq0UrD7h5829ZgzLmFRE6QKefObNLnmfFPr4UpwllrBk01u/1Zxwu62LSzTh0FEMDLwh5fJbALqCIHhsGiXija29zPZqIqsXzMdeOfxk4Rl3ViRQZjFWQvBv+fT/DS5+R5eOTu7BlUBontab+FOR53FkogNLNnmAY/cqdChr5diQqqMt+GSmKQEKKiJbJEHZTkW8rLpZhXvpMt/53z+Bd0NvDJ07lzF0JAAAxggLZMIIC1QIBATBvMFsxCzAJBgNVBAYTAkRFMRUwEwYDVQQKEwxELVRydXN0IEdtYkgxHDAaBgNVBAMTE0QtVFJVU1QgQ0EgMy0xIDIwMTYxFzAVBgNVBGETDk5UUkRFLUhSQjc0MzQ2AhAWWKzSNTU2KxHZR1S5cUeQMA0GCWCGSAFlAwQCAQUAoIIBBTAYBgkqhkiG9w0BCQMxCwYJKoZIhvcNAQcBMBwGCSqGSIb3DQEJBTEPFw0xOTEwMjUxMTQ1MTJaMC8GCSqGSIb3DQEJBDEiBCDDL+1tn2qcwXxKCYpy8wkoKDJVkk/aT8ZNiNyWTl98KTA3BgsqhkiG9w0BCRACLzEoMCYwJDAiBCAoidkQhGwSlfYDfbZidiw7MfHeFUlff/MPvl+g2YXwZTBhBgkqhkiG9w0BCTQxVDBSMA0GCWCGSAFlAwQCAQUAoUEGCSqGSIb3DQEBCjA0oA8wDQYJYIZIAWUDBAIBBQChHDAaBgkqhkiG9w0BAQgwDQYJYIZIAWUDBAIBBQCiAwIBIDBBBgkqhkiG9w0BAQowNKAPMA0GCWCGSAFlAwQCAQUAoRwwGgYJKoZIhvcNAQEIMA0GCWCGSAFlAwQCAQUAogMCASAEggEApapPUQkXkkVFJ6xfJaOKJmOYw7VLAmIgKNOe4YUwOyLeOQcsmuVK/F7n/4v68c/UKK1w6M0CGHtPKXDe1ByA7ofBZa+CZw8rrbanioX2n9soKAFZrlYALdqbpyxFwmhdPWQFUzkHCW38cpUALokM4A5XlKqHrkYJVkWvZROp1fjHI2rFYXuFwV1/lw4OzM8uOcz1lJYl351ww7X/Z/V0lMuG7sVoo1byuBYh3D6ETchJw5Zf0temMFkX464pDR6n2ew/4ybmajowYG54TOorEBdgiYbEMQA72H3PuB47s3/G+9AgqnSorqvsF7BMC/1+3fTxASfn8Zjkdi7KuXFncKEAAAAAAAAA</dss:Base64Signature>
			</dss:SignatureObject>
		</esor:credential>
	</esor:credentialsSection>
</esor:XAIP>
