<?xml version="1.0" encoding="UTF-8"?>
<esor:XAIP xmlns:esor="http://www.bsi.bund.de/tr-esor/xaip" xmlns:ds="http://www.w3.org/2000/09/xmldsig#" xmlns:dss="urn:oasis:names:tc:dss:1.0:core:schema" 
  xmlns:xsi="http://www.w3.org/2001/XMLSchema-instance" xsi:schemaLocation="http://www.bsi.bund.de/tr-esor/xaip file:///C:/Projects/BSI/Proc-XAIPSigVal/60.Abnahme/220106-cli/211130-TR-ESOR-Schema-1.3.0/tr-esor-xaip-v1.3.xsd" XAIPVersion="1.3.0">
	<esor:packageHeader packageID="x373f4e59-69dc-4a77-9ea6-75e91a74bfc4">
		<esor:AOID>40387ca1-4497-40fa-acfa-9976132b1001</esor:AOID>
		<esor:versionManifest VersionID="V001">
			<esor:preservationInfo>
				<esor:retentionPeriod>2100-01-01+01:00</esor:retentionPeriod>
			</esor:preservationInfo>
			<esor:submissionInfo>
				<esor:clientID>remotebean_esor12</esor:clientID>
				<esor:submissionTime>2022-02-10T14:43:26.898+01:00</esor:submissionTime>
			</esor:submissionInfo>
			<esor:packageInfoUnit packageUnitID="_idx_DO-01_V001">
				<esor:protectedObjectPointer>CR-01</esor:protectedObjectPointer>
			</esor:packageInfoUnit>
		</esor:versionManifest>
		<ds:CanonicalizationMethod xmlns:ds="http://www.w3.org/2000/09/xmldsig#" Algorithm="http://www.w3.org/TR/2001/REC-xml-c14n-20010315"/>
	</esor:packageHeader>
	<esor:credentialsSection>
		<esor:credential credentialID="CR-01">
			<dss:SignatureObject>
				<!-- ASiC-E with single detached TSP and mimetype -->
				<dss:Base64Signature>UEsDBAoAAAgAAARdVVSKIflFHwAAAB8AAAAIAAAAbWltZXR5cGVhcHBsaWNhdGlvbi92bmQuZXRzaS5hc2ljLWUremlwUEsDBBQACAgIAARdVVQyugebjwAAAKwAAAALAAAAdGVzdC0wMS50eHQtjTEOgkAQRXsS7jAlFBpcY2MJNrTiBTYw7E6Q2c3sEMLdLURi+/Lff3lWLzxgsrPC+BHoqPcoHkmBGAYUaHkMMlulwEmx90wTFHXXlnmWZ6/nqbpezO0ONa5IaUXRXbdvXdjBJFvU4MRGT6n3kMgxHQt4hGmZkRWPF0w6/MH5B5oQNyHnFfYQFE0JpjLmC1BLBwgyugebjwAAAKwAAABQSwMEFAACAAgAI3g6VB4OGwvlAAAAcAEAABUAAAAwMDItdGVzdC1kb2N1bWVudC54bWx9kEFLw0AQhc8K/odhT3rINlkRJCQptEEQ9GJT8Jpmx3QwncjsRvS/efOPuTFozcXrm/e9x7xs+Xbo4BXFUc+5SnSsALnpLXGbq211E12rZXF2mrFL0gqdL2uPDAFilwYtV4NQunOkdwNbbVF7iS8Tc6V9MKtAnkwoeeyK6iH6PsKYZPvn4YDss8XR8GNfoWv2ghRC26KsHZDzgMQzEJ4+PwQsIZS1uIB3wQ0WBR7v76INtVz7QZD11DDLnIpMuu5f3oXavf99yfz/km5EFUfqfH0Bq80tmNjEY82fxHG1xWy2oHwBUEsDBBQAAgAIAFlwVVQ8GjWOkAEAAJADAAAZAAAATUVUQS1JTkYvQVNpQ01hbmlmZXN0LnhtbNWTXW/aMBSG/0pkLqvETgYrIEKVFqLSKYyGwKbduYlJvPojig8k26+f0zGkaau0Xu72HJ33ef1Int10Ujgn1hiuVYh8jyCHqVwXXJUh2mWxO0aOAaoKKrRiIVIa3cxn1PB8Gm35XUIVPzADjo1RZtrPQ1QB1FOMjw33GBju6abEJJj4Y3zyvcDzB+icsOVlyg6ssUTmJFyy7FttGbSuBc8p2Er4pIqfIWDXtoisXdDPTCFnl65ClCyzyF2tY3xZE+J7YADhM2NBgX58+spy+BsKWAe4FpT/CgSb4vYRHdiWhZkueGlHCYNKF04kSt1wqOTlkW3beu27lycGFo3JEFsVljIwFQ1G79HZTGFeOSGYTPqTwvBy0Le+MPdUHNnbzudxPPowaUZ3u9198yi65RKnT58pJfJ7fth+OspAXIn1av3QdCac4d9R8xl+zdi/u7RVziYJCdwXm4XOj5Ip8Prdf+g0i9anUV6M0y/XrdxcPd4O9w/3189dVaabap9tIE5u80gGi274Nqf4j280/wFQSwMEFAACAAgA1HzvVAJumUZaEAAAuxcAABkAAABNRVRBLUlORi90aW1lc3RhbXAwMDEudHN01Zh3VBTZtoepTjSpyUEkNIKD5Opuck4CLUGyEkRSI0gUGgkjNjRNkiBBFJAoo6ggypBUJEgUEAQkSUYkiagIqCS5zbxx1HvvWu+u+2ZmrVf/1Kqz99ln1z51ft85BZK5qxF04tEG0Z+YAFpIPpn7Jkjm/gUCQDHMIBOCzjHaACBAYRAonAYMRjD87kjHAsDyPWCnQAIEABCMEggABmxJQKgBABDzfTcATgNDU9ieoCNuboRBnEII+TpX2mTP9lrbOT2ZL5E05HZa1OeGICFdaQts7yt7eJixIBYLKmDkMDicAk7JFoSFQ6Cz+WR2FEimlQPJsMV8KASAQJBHB2c/Xj3uGwNq/ZE9QA/K5v9z0gV8IO83D+Q/Wa9Rg2mCzhgGkA4BtYIh2CG6hzE4ELP3QM8orqtvgtYlBBIDXNwJAWh9QkCgj6s7wYMY4EMghqItCP5nPVwIaH1vZwOMAMi31wnKyOl6yifgd4u5ry8RjcEom5qAAtxMGCVQHiOLATHyGJwtNxNOAcThMBgMSL1s/5YcyJADe+//tRjUuYGSIcw01HZ6CBkC0Fw3KNQi2FpM+hcdhz50bD5xWtEVLqLHFyRNkC5L493R6gZKgtJJj8M5gkgQSQ+bs/UMenTiMZO0PNWbFi6vjvE82DRsWBgmg/HwRypqN+k6vWmrCmdnYveh2rXljzff2M/cJqm9fymlK0js17xDkQPyJ7quR8NEj96rdjFXjk9G1Chk0w3NaZlVCGBvPpu7xsIfkucmQXlxUciO8YADjdttpmyihzyd2dPDNCKz8TSyTyo3JGdUD6ie6ujIjXtf0MTqAWRhcsFBrZlHHDaLJjtiLzmyI1bUmcUNc+nzCASYhS3rjm2JFYL9vYpqWm9eC8RH4tdW6QjsuZrl51f0KRrF9iKAFR/B/p5rvCiSib7HY6tJTF7cODutozAivWz+9H3HcJJOrYHwbb6327p2kuk7g5zmv6zVju64q3X82uJtlscvXb9Bkc2eiKYxqhU1kJjISF6a7OddL58/IX9meOsTuq7BYJeeTsGwdkX1Ia+xYuYmnpVrTlZxKpJ4W8k8P3jCeNziYDGrFzPR0Wiy3RcdEGAXw6lxViUUMV1OamPYElzhucBZ8CDzVa0uhNOlwk4qJ40PjlKlm9HEkLg8zWNINQIvzFnqbfDulpyoyK4T6EzdSnO56SLDGE3IM0b6ZNPweQmdxPn6i3bkvHtZ7+W8C+MmlqyNpvBPDlc49gmUWz2GQAEaoJAMRIFkIAJkpn5L/OwAsAuDg1DqDRTcaxCG8YBc4Ry0PE4rJ7tvBVa1PuMQfzh3h6trRBqMSEcgqVIAh9MCACwiFoyIAo2/toCQaC13ItFPWUYmKChI+tsHKu1KkCH6BwYQXQg+RIK/jF+gs5eHi8w3BxkPH1dCsLQ70dsLlP0jHBB96Pdw/r4uAX5SVP8fgyorgoqgzJ4N9NhLHA1zBh1BBwTDN7ECwKPfEoQAXH9Cgvx7Q6FgXLB/XyHUnpl5r6YwqvJEg/sRdL+l0+ANhcNQICOC/o9H4E9QNujeqj4ly8Z8UNJsX0ZlRvFCeLsQKMIZ1xBVYPlywCaD/mlrqfxlcrJQ8Edd7kXIouDay5oXDrdDDlQtmOVYZ9Fx9O6MLodeaVBwRsOS7jrCmzd5AwZFKeJO8vZ85QPuTX3mJd0fWoh2qcuHKU8Xe8BL/VwEPT7KDKw369P9QzQ1KxZO+LT3uZvnhunsva7r0152IHqvB86rsA86j2ce4Y1DDGpvrFxI6AIetPqakIvuK6+KdZwWWZ8UmRks0K6JDkuvLCAVCwcGFas59rZEzyZbvS5Vm4ojS5k9Dwt7ONDr3lTSQzEOUwrtOJ+vsXayivK5q4mC1q/jC6344mWSfWdFlfd5wcfulY03nwSWVCJqBx7zh0rKac3i3W8taZ4XdhbwWfpwY+rItNDGJTVdrQtpuUOOljXbZ2LFkuyThj5uVyWnjJQ+uO2QMzidt+h5MDSa5eFYWa4kYn1HEucut8b22v6YY0lpSvxifM3JUZurwmitL6VeNEwCSsOH3Y+x5AbHF2YQ3aXSGut9saQXFAeBd04fTT+7NjLHnP/ZcnGDXMYH53w+sLltETfvYe3duOG3vk0Dx/MmEl5iZi+9KfMQmUJxPUxzLkgZz3UVc3HgELs8mjR6xbVSI1no/GtG96rYxelNcXqzx++2teO0nE4wqVdE40K0LiKzNJ+Z9l9JweIbuULYd7lAMnwOJEOzfgen/s30UW91Wdz/P3BiZRVl5f8FnE5/Qg781IX4Ww4c3+XgpqOFxmB/4ybwr9wE9rgJULkJADSFn0jicR7Owv3ARnXtKwJic5jCMqYZfM83r6sh672RLNAFjHfzPFi3XaNPY3WGF8nGbrcyW11lZazlLcz9mDwmR7IcHt+XVJI5WX8xHRb3HtFy0tEfxtyAy8rCka2yR0mncI84vSRCTkhno+5JHHviX3VYYN6ajsO/I0NLD8kkOUbDiLW551xtOmjNb5fVx7nBedv9WFl32TRrcFGYxLMFmWbP0LO7tKPZnjvGMtcNkYvjk5eb1rLeyuE78UcMvQsuXehO2VktLOdKyXqjYGbrm+Df4C6IJ3+ZTs14aIL3yw7q0/ahCQ89NIdrTrviw8eaLFMdKta5Od5PTM1KC9mU+coNBWpFcCDbH9xAggjqjSpB/zs6dL8jhyIo/18K/en/EXoX0Ak8+d2ulLoN/SuV3mN6daZ64fKpGmYRpJoyo4LRqG/dj0oPgf0tSs+1GwcvnRyb5bb9rGiYadBZU7qaVO3xVH1Yo2BAaZ/MiJN/ZufEjOryWU++ylOpFhYQV/o3LOpNjMWCi5Gj+esZCVHqfQlEYzrA7C5G0Z/3LmeGd18KsjfczhxVsRHThMrI9fbtgWrnCuXA6oY/KScyCbPKR6wcQJYqTUnRhNT0maEb6r1VR1aMZ5jWPmel6QgveHm5IFUuap7nLSG6mTMmHVLTcLeWYrRvQztq4rHlx9uSFRA6RBOon+WXy3Jp52ImXwGwSpc3fQmiLGTyjakTLoR02m7Ku7KoXpRR9oeQ4+ddxOPyVo0TFvTt6FTqhBrqXwp4hNZ1SvJmkTYsA7+EtWbd96Lj2YmanET1aHEkKHJiTm5OrTZq+x1AC7cNFHnYBctC+6bvLpaStsTY1mITk23dmHutbA/O8kimfHRl1FjAnyweQimtWeKqC4kKClYGlbsStXYhy56wgJ5UU9e0WazJTSdG2sK6w3OIwaInNBej4n4xkk2MFPcUHecRaYajEzr0Khat2qcflqFVwtsKneQznqyA4cGDAfUx5iDPT/MyoRvMzmEGy5/Mk+ZeTa1I9b3L6T/8uRIn4ja3P9RphqUFgnoaLmnKr7DL8thmGh45C7vKbsqQOH9EfQa5sPVO68GuJjaxRj0FMyuSigo7gJWKaI82KhvCzb1Xzs+jUJV+nnpEuvq70h/CbslcGUVj/gyl/xtU9pvQ47CgLPgXC/1eJ0sLC7SFxykfgj9aDvefHJAKl3mHsg9W9HZ+LA6VMDpJsY27/OFZ60DOemwXgH8l3JvO56Rfy8KXcOZ+bDUKcV+eE7lLLyJp2HA2uyscfyv18o2l/JwHqgpvFwOLuo8aHroCN8ino2ipTbAMsbOsri2raKlFJIW+mLsqwAYKPmvvFSo5nfHFss1bXu/Zz2WmWtIjmGu5P5lnbTB0Uz6z7esTp3ujmANNVK6o060TK9g+xc92Acg2N9+RGODW0wi+ir7/VOHxuH9IGZpJoncoNVMtZgwZmC21+V4ann/v2iLcU+dXyfgXPtwhjUZu4y6sudXHndlCPAV8jiljv3j6ScrNTXKGztGmq6i41bSLCXUiB3ny+miB1rTEoojjr/FKXi/OmKZEd5mcI/uDqauMYacdD36sv29BSxkytguvZr4rOATa8fgVBZlT/cIm5rL0hmryl5+MqQ/oWT2SdeznylG/Kz4RNGMnM2m0/tPF8FtmLsH8mbtxvNqc7lJBO6g5QiXTTcGEaZjMCtPC5vnT+/1DJJDnjB+sKrFM/Upfdf1KPJ5oNG7m31zBOh9tEKO/dlSiVMgoL4monzhl2T3vPLRYFLVhs2U9bnX+kqSQBN/QEAde6JyJdF0MZ59mm+DGLlw1drgNer0sXMNwFv380W1a5vrQJjoScdY7FrFdMiPSbJRWVuE1efyX0Dt3hWPNWkYMjSO+gk6JCjo5qoZ/BR0E/BFx/5YI/wni3P5bxNFCIH8+4rj2xjq494KMIP3X0FDkd+gzH4w+3J1pCH1zUSW4llWAYn/1y8ZfjzrqlutC86A6DVtiE+UxaK0VmDglMjn+4CKUoVd691N7zJj7aSF10sSiENckcqb8KYBoAXpiDfZTds+P8B+dGFdt9fhyneND/Kche76E4yPivjnu4n4bCUEFJVjRvkJjnXzR8E63x8ZitxZufJkK8FFfqc1vf5SFm7+1sps0V5ic2q/WP39dLc3sbW/NLEA257MsewatOZHv3Yxczexr62qz0m9KIGV0yCqVY0dgArmtwsf9yvbhjt4ojMZy6Yo+GhXeesnjRtM2I3z7JPQMR+DrY/oq/u+YAkZHnEPIxj7Z/VkFGgtCdw9hS/Cf3R4RLwSWJkrkwAKzntswvP3Z9IjnQGgqGIchw6iyBN2GAADo/Teo83c0+XFK8skA+N2U0UExTD/8JaTu7v+wwTHM3Ew//t47+s0Kw2jDNENTOK5R8loylvhsDhoCDk72DmzCFUvQuSDBgsyU8xO0vXHRn8cH3vV0Dh6JaZQW6osj2ik2PciIalLuPGRwa3IXjLj23fAQRkxEKhhxEYxIACPiYBxRBsFMOuxSDnHNiTcXRdfNdHlRa+AZkPCLy99bwv/7IoCRITQHhNfZiRHFsneKm8bem37uOTWuiOwO384IYznxVmziatw5/CJqzLfitqn/psudlxuIDOEoEt76pEohflZHo7oJqnTfHjdWvrt8ZuJOV1XBWc5GKzlp9WfqMzngh63kFndkxdX2PrOGTZpuG0/ekLis5rkLQlsG/WoxdY98U8eOLqlPpqlGvnbuCSs5Ulc7HHAl5KfO/bnkVqSXMDag4yJi19m68/XUC8vrWqkqspetCuYaBQRJWx/4DB5Cnq7D+NtfxYxcTyg+MmQqKIx16oh34XV9gduvJn+vL3Knc42wjhLkt+aqH9zE2Bm6VwWzO1sIiAYf7bhmwrfC/vjJaZjflyote8hbi0+VGVZLxzkS1of1Kws1uie8oH1zNgc+q0Qw9JU/2CnJVCQ92XabHz4HVhQMvFv+4Fv0s+s1hPRZ29NHseoTqGNP2xOKJkdDTnugBNJfRtExkVI4ZSCx/VE8L5P6nt40aBRSYtQOXR8rZDcxbLhbuWxIuXRMjwcurkKqrjwYQxpTKO9kudI25wAcu9wiT+iPrOCKfPwiTEDh3pIw163rXqvPpZNVz9QpbNzgd7qrQRoWi+zhV0p6lh5cuB0TdkPqXaLTS99H8yPKLjxvzkqG00exDQUsXGI4nPvBRluUUU9Er5FIkVxVvqZbXi/cIfOGs4XsVXVIsua5zrzU/thcXZl/AFBLAQIKAAoAAAgAAARdVVSKIflFHwAAAB8AAAAIAAAAAAAAAAAAAAAAAAAAAABtaW1ldHlwZVBLAQIUABQACAgIAARdVVQyugebjwAAAKwAAAALAAAAAAAAAAAAAAAAAEUAAAB0ZXN0LTAxLnR4dFBLAQIUABQAAgAIACN4OlQeDhsL5QAAAHABAAAVAAAAAAAAAAEAIAAAAA0BAAAwMDItdGVzdC1kb2N1bWVudC54bWxQSwECFAAUAAIACABZcFVUPBo1jpABAACQAwAAGQAAAAAAAAABACAAAAAlAgAATUVUQS1JTkYvQVNpQ01hbmlmZXN0LnhtbFBLAQIUABQAAgAIANR871QCbplGWhAAALsXAAAZAAAAAAAAAAAAIAAAAOwDAABNRVRBLUlORi90aW1lc3RhbXAwMDEudHN0UEsFBgAAAAAFAAUAQAEAAH0UAAAAAA==</dss:Base64Signature>
			</dss:SignatureObject>
		</esor:credential>
	</esor:credentialsSection>
</esor:XAIP>
