<?xml version="1.0" encoding="UTF-8"?>
<esor:XAIP xmlns:esor="http://www.bsi.bund.de/tr-esor/xaip" xmlns:ds="http://www.w3.org/2000/09/xmldsig#" xmlns:dss="urn:oasis:names:tc:dss:1.0:core:schema" 
  xmlns:xsi="http://www.w3.org/2001/XMLSchema-instance" xsi:schemaLocation="http://www.bsi.bund.de/tr-esor/xaip file:///C:/Projects/BSI/Proc-XAIPSigVal/60.Abnahme/220106-cli/211130-TR-ESOR-Schema-1.3.0/tr-esor-xaip-v1.3.xsd" XAIPVersion="1.3.0">
	<esor:packageHeader packageID="x373f4e59-69dc-4a77-9ea6-75e91a74bfc4">
		<esor:AOID>40387ca1-4497-40fa-acfa-9976132b1001</esor:AOID>
		<esor:versionManifest VersionID="V001">
			<esor:preservationInfo>
				<esor:retentionPeriod>2100-01-01+01:00</esor:retentionPeriod>
			</esor:preservationInfo>
			<esor:submissionInfo>
				<esor:clientID>remotebean_esor12</esor:clientID>
				<esor:submissionTime>2022-02-10T14:43:26.898+01:00</esor:submissionTime>
			</esor:submissionInfo>
			<esor:packageInfoUnit packageUnitID="_idx_DO-01_V001">
				<esor:protectedObjectPointer>CR-01</esor:protectedObjectPointer>
			</esor:packageInfoUnit>
		</esor:versionManifest>
		<ds:CanonicalizationMethod xmlns:ds="http://www.w3.org/2000/09/xmldsig#" Algorithm="http://www.w3.org/TR/2001/REC-xml-c14n-20010315"/>
	</esor:packageHeader>
	<esor:credentialsSection>
		<esor:credential credentialID="CR-01">
			<dss:SignatureObject>
				<!-- ASiC-E with single detached XAdES and mimetype -->
				<dss:Base64Signature>UEsDBBQACAgIABGKHksAAAAAAAAAAAAAAAAVAAAATUVUQS1JTkYvbWFuaWZlc3QueG1sjZDBCsIwEER/pexV0qonCUZvfoF+QEy3upBsQrMt6tcbBbXixdsOzMxbZr29BF+N2GeKbGBRz6FCdrElPhk47HdqBdvNOlimDrPo11GVGOe3NDD0rKPNlDXbgFmL0zEht9ENAVn0t18/QW814S9hQuvIoyrp/vrxdoP3Klk5G2gmFQFbskquCQ3YlDw5K6WyGbmtUTLV5TencHajBM3/CCm6PhL/QYpOUFSWHm14IJqf0TZ3UEsHCOVQCQO0AAAAbgEAAFBLAwQUAAgICAARih5LAAAAAAAAAAAAAAAAGgAAAE1FVEEtSU5GL3NpZ25hdHVyZXMwMDEueG1sxVjZcptaFv2VlPNIOcwCUrFvMQsxjxK8MQkQCCRm8fWN7dhJHN/u3K6u6hfVmfY5e1ysrW9/zefq05i2XdHUD3fwF+juU1rHTVLU2cOd6wj35N1fj9/Croi/HuiEt+0iq8N+aNPu0ypZd1+fth7u8r6/fAXBoS2+pH1XfGnaDIQQCibBEf6CfIE/3z1+S7qvb9LfhZPuTXSapi8T+iyIQBAEQhS4nkm6Ivt890lKHu6K5P4YwQgRJ2EUbpDjEU42CBmSKAmHEYmQ2JH88UiaSPWxeZ6yYd3URRxWxRL2q5Vq2udN8omusqYt+vz8NxrAIAw9aXCfzvF9DGP15zvwVxv++CIIezXl/ty06ee2C++7PETwzfcrrfSYtqvb02dD2/vVVPjuk3O7pA93d59cS3q469Ou/xIV9YuJXJGt83+owPrA51+efbnFC6shfZwELbUBGa1BxJEtVTCRESscQbdPwDAJhAEqPUXObYBbzcM38J3w88KbEe9MejHjwwSBKQj9/BIuo20uadsXaffd4M9zmKTd/R9H3WnDujs27bn7dfpfBhr8/cr/vdO3LYmx2BLPNd1jtGwJ+XRB1Z1TKhaWdiUBN0dQFmoXjN3/7HTw99R/S9VniefkGp9Gf+ZV3+giwk3rlsc7+cKtv8XxlFK5w4duWSq3WseB9kjV/XgIFH9hvFxz2tLdXuo2g1W90ByV2ubqcFhyUtFMZufmE4eOQSdEO0lWBgc+scKy2SX7mPHabKOblRdYJh0JrnOenVbAmnlcssOeDZQgOmjxwE8s1ycWpxwip/enbdmeG3nL2V0TkF4NFSfpIkSOThKJbzCbIQfKBapQ7eRdKneEVfVSj2MFbpeOKQ8FPQODp9rqvqyUIFfBcssfBIrQ3dFTfQ72k351/bYDBGLjYKVlAzgjt3O0p4NxW5w53oIMsa6LkLWsOgkv+BxxOJ70eI9DE25sSlZutkqv6JGw4zmjFHfmEVRr+uHhLVI/QvMcLTm9vUXugEMUF/bh24R9Ko7jCmN9+qhKErs5sSydyBk9SQydSSJbh6wcl4hKQyJrX0VbilDO5Bl2cmmVo2dxoQMm0zyGVlW+2o0RajnBfj67SFVHZ6+0zkIbOLyl0qRIwy7PZpNkCZqjHKwqRs1pm8ea6sSTzkm46rizdlKh/euaI0Gqw0Pa4mL7E92oljrxps95pslx9MUJ98kQHHaiv+8r1eInbnrekzk6511Y7RPRWxJutceWJs70d3ITSPkYa/SqP2PSXJbxBv20bzbsOmbonc+WDJBeolsWDIe4b4wzgXnHuogYi3VMW+ySwd6Ol1HhrnZd7bftAS7jG6DmywbKxvyQbrxB2POIycaIbstAMlF7wmsj8Qzy/sgJmXZ0CARPN+E23AKgCrV2yWmGYg3qVA4iQm4FQ2r4vUTsE48Y5AN01PGcskkm7edxXCrYPmN55W92GZWdCDGEs+sWQOkUFl1ZmNqAjLaO2m0nrDMQ9JCk/qluuU3auEBeB5vTCNKb2+WKDZhwQSh7WxbHYNRtqMwM/kDtpG0PeH3sZq4FZITitrqfLTcsjJsz4u9KSCjsevLnTYO2wITGtDcZ3LGDlhBY0NTIFY1XinOZkjQZ4IaDngVy8A8dS088TYdrSTD0xGVrjNYUp80tyNAmR2e8+FFu0diafyYrsDO0UIx5PdkK22BrQDBKPIgtCBbLXis33CThEzRVYAQ5iUWKp4pe4pzahEY0gRQmEmdDHS4BmqU3JIPmVNmmPIE00CXoSnO/UYKxLaUjRCE7hruRnG6W/JzXx4D2VQ/HFts4UQSy1c5n0yAC1KVw9WppxBZG9XT2hSlSQ01kRIe0ewzXDyeNSBHDCeXISHvIpQDwOFqqcb3NgX3KIRMIKlvOgFS5YJaxX2KmEQ/7ZN8pwLWfhtmWCEHT8J0kFScojeLC8pwq98ihITs8nndnexuNgEcn5syGiYwCdOjxF57H+WtMJIg9Qdqg1lv2jNtwGDPXK7Ic9EXrrK7Wo9i6cZN1vEwX6Rko3hf/3wEC+QwI1zdA4DHCrMU98X8GBHQFhEm1ukl8BQRmZ0cIBbmI1wWVdgkQvAr4YP1EujPv0MaLTo3K8pbj3mAoOGjQah8jnWiNycprXhYiNUFr0vECTesrKJD00z6byeuYpyvOPMbmYcvPmIMpXbU/V8RyvQaTd7hA835I1m9YjAzDTMsHHIevLhn0kh8YcolFrAdb8KYpd+f8mvWIe8vma9rFE+ufXYJhIOoqnuqinVFoEuKrcN4PWUznunGbdsZAOpJ6GWNXz/O55bzAh5nzVGjDSGnDvrqlJlbmngQFUggfb93ggdyG86a4U5d6pp3SrHlWD8+Sq/ucpYONmRrgDDsxKGfLoY3h1urGufCmUfOBUCZTxfOPGgLdEHmOW7zBGaY6HWUU3CCodKtsbyvhnQSw9kpfAETD0HnuYpLq7YtRTb48yuDYCFKKnhLBt7vlTGMThYU9d6v7jd8TE0aOlbhI0oqGs3EwJY42aaaZpYnnaP0pRluTZOgjuaKxuvrdfw/cynfgZmiaUxjHljJ8UeFIa/eJRKmJf9pxa5nQG3ZiUjfBT71T4Vme3chAIwaMlITFXdKUJmDcrmDZocA1eytGriSxZDbTTMoxYcQW4BeH02BccZjh05rQauq2WcQFkOTW4YTkkkYitPjDbbswQXAou0GcUFcplobr9eLWYlibj8B+ArgckJQo3NbUEs36EWvOejAdsP5GR3GwUDVXl6RQT3wyzitUECYwDrc+6HZ6FlwEVwEnl4MGFpz2+3lHAVbACrGlRrNxlc9Gr2hRH+NXo2lOAWem18FjUnyvJyvhO0yEOKQi5+hlwdMKOFOqicbhhtdyH+33G0cZDSepdbstDaMCBUNOqA2h66P58DE4gL9wB/Adq9CjNff7x2/P1PqrOaw90fG2dno/yPf3vuz5wL8h7U9dHfoFWTszJ2yztF/p+p8R9ZeX31P+Z2b6T/j+z9e8Makf9/18YDXPKc7pIwLBxD1E3qOQA+Nf4c1XFA++gb+f+1X0J+d6yOve0+LP4xdW/s97hF+a3LVJgD9oEbB8zJA4xhMo2tysDFKYnsuxnY2j2Uctwe9KvaxIXTekrZ22RVithqgcNmmyefsffAhYJrsgWVHvtOyJ2n743M96Pb5z+jsPg/8gtGnylOYvSf37iR97woqBYf/pZfLWMa05+73TfpVQ1/g/dauP4eVSPWlUNDXYxH3a33d9m4bnV+3eDr4uvH/rnR0fqwl+XAxvGx/V50tNv9bxL43EOv3ob5rHfwFQSwcIRHNfSa0JAADjEQAAUEsDBBQACAgIABGKHksAAAAAAAAAAAAAAAAIAAAAdGVzdC5iaW7zSM3JyVcozy/KSVEEAFBLBwiVGYUbDgAAAAwAAABQSwMECgAACAAAEYoeS4oh+UUfAAAAHwAAAAgAAABtaW1ldHlwZWFwcGxpY2F0aW9uL3ZuZC5ldHNpLmFzaWMtZSt6aXBQSwECFAAUAAgICAARih5L5VAJA7QAAABuAQAAFQAAAAAAAAAAAAAAAAAAAAAATUVUQS1JTkYvbWFuaWZlc3QueG1sUEsBAhQAFAAICAgAEYoeS0RzX0mtCQAA4xEAABoAAAAAAAAAAAAAAAAA9wAAAE1FVEEtSU5GL3NpZ25hdHVyZXMwMDEueG1sUEsBAhQAFAAICAgAEYoeS5UZhRsOAAAADAAAAAgAAAAAAAAAAAAAAAAA7AoAAHRlc3QuYmluUEsBAgoACgAACAAAEYoeS4oh+UUfAAAAHwAAAAgAAAAAAAAAAAAAAAAAMAsAAG1pbWV0eXBlUEsFBgAAAAAEAAQA9wAAAHULAAAAAA==</dss:Base64Signature>
			</dss:SignatureObject>
		</esor:credential>
	</esor:credentialsSection>
</esor:XAIP>
