<?xml version="1.0" encoding="UTF-8"?>
<esor:XAIP xmlns:esor="http://www.bsi.bund.de/tr-esor/xaip" xmlns:ds="http://www.w3.org/2000/09/xmldsig#" xmlns:dss="urn:oasis:names:tc:dss:1.0:core:schema" 
  xmlns:xsi="http://www.w3.org/2001/XMLSchema-instance" xsi:schemaLocation="http://www.bsi.bund.de/tr-esor/xaip file:///C:/Projects/BSI/Proc-XAIPSigVal/60.Abnahme/220106-cli/211130-TR-ESOR-Schema-1.3.0/tr-esor-xaip-v1.3.xsd" XAIPVersion="1.3.0">
	<esor:packageHeader packageID="x373f4e59-69dc-4a77-9ea6-75e91a74bfc4">
		<esor:AOID>40387ca1-4497-40fa-acfa-9976132b1001</esor:AOID>
		<esor:versionManifest VersionID="V001">
			<esor:preservationInfo>
				<esor:retentionPeriod>2100-01-01+01:00</esor:retentionPeriod>
			</esor:preservationInfo>
			<esor:submissionInfo>
				<esor:clientID>remotebean_esor12</esor:clientID>
				<esor:submissionTime>2022-02-10T14:43:26.898+01:00</esor:submissionTime>
			</esor:submissionInfo>
			<esor:packageInfoUnit packageUnitID="_idx_DO-01_V001">
				<esor:protectedObjectPointer>CR-01</esor:protectedObjectPointer>
			</esor:packageInfoUnit>
		</esor:versionManifest>
		<ds:CanonicalizationMethod xmlns:ds="http://www.w3.org/2000/09/xmldsig#" Algorithm="http://www.w3.org/TR/2001/REC-xml-c14n-20010315"/>
	</esor:packageHeader>
	<esor:credentialsSection>
		<esor:credential credentialID="CR-01">
			<dss:SignatureObject>
				<!-- ASiC-E with single detached ERS and mimetype -->
				<dss:Base64Signature>UEsDBBQAAgAIADFtM1ThIHT2HgAAABwAAAAKAAAAdGVzdDAxLnR4dEvOzytJzStRyE9TSEksSVTIT8pKTS5RcPHXNTAEAFBLAwQUAAIACAA0bTNUW3F9bx4AAAAcAAAACgAAAHRlc3QwMi50eHRLzs8rSc0rUchPU0hJLElUyE/KSk0uUXDx1zUwAgBQSwMEFAACAAAAVG0zVAAAAAAAAAAAAAAAAAkAAABNRVRBLUlORi9QSwMEFAACAAgAJ20zVGRlcqPhDgAA3xYAABsAAABNRVRBLUlORi9ldmlkZW5jZXJlY29yZC5lcnPdWHdUVEmznzuJNDCA5CAjSBKBHhgYgokkQSUPGQRhVhQko4AIzIiYkIwJgSELgiRFUCQqYgCJoiKgCI5klCyrfAOru7q777x3vrO+8973R597qqtu9a3qX/+q6wIqXy8cggAWsKNZnKMMIDICCYdQMEDla2SMWsa4Q/tRlXkQ6CJxVwZ7Ok2XtCKZdNIxGaJPuK+lh/byLo3fH89XMZCCV/ohcZNP9iib142QP58Kdhpoz8XY1aVs4YLVmY9VXGfr1JGTAuJIXPWlwmRSk/r7YqRSra6IBrpLIIac5nqaVWrCbffnzvHrjOW3oFk2RRlELbBDTHAalU+eMSULhxD4v34xJIFm+2rKwgkhaVSIG0mFOBgKVkaIaBY5NISEBr0RcID/07tIXGGnpOrmKkc1S/+EVonYa1xPpTInjco9ccB1C1w1RpsE54JFyGlpwmCQnYzt5xfLciopAlxKAE8ESniAJwCiipKCih1AwyFYBOTGsL7dzseUcmGvYnft6W30fEsp2oHs/YCMZwMsaAQJiV4H19XDSwKJVYEVI0IOciWTA3AWZNdAPzLOwtszMOCAt5c/Tv/QPgM8P+BdNXPBcBhbmuvqyRuYaxPViESA5wM8qwoEhv3r+5YWWjhAyBAGgmhmRrQoFBOEQLKD1UWZkDDKBScIolFZPwAqSh9QEUdpCDgEh0NooPV7jiFWQKD9ObUZIkDoDwvmP2kzGV5wgPRvhSYGRH+LgO+rWYBfoH+AK9krgOyH09FSAuv52fGqjAwrA3WCGoFgx8+uhGeISmuist3/UkYZEBJfjfpbChhRI6gQFrYGLSoEwSjGzfX6xfKySI3Ni4UU+2kPbsRUq/R5D9noI1vtnIqv3citMbYbVA0R5hfZWDtWh9tl3KI8pdaf9SzysdL6udMOD4f8VNPjHGdGSfQL6SciHFpcXHLkX5eOPXrBcY15rvRX7IPIMS6FWxoDLqPJ9ZbWbodObaHe0+k+K9esN1pHS0wzH8aqDkWP3/DIqdmviZSSkq8cGbC/jsdoF0TIFVl5YLdu28MaXCN2u7qpkN/jGuGgGSKoit7uZR9jb7opx+JmxADXusNSZ2daB2h2ksuOO9wE5B5avEVxl8xIpFb42Y1fY/bX7inYfjpMNG8Zt0CJBZ0r66+O5kKXBL1y+JR1dl+CIyAYlEWFZBgZ2bi2p6IcSD4kD8zxbSm5zE4rjeZmw9woN1ZxfnIQHFtVSyAPg4AInqwSKarIB+3gNqFC2b5Q1AVsf198hm229U/CE2OvgPrvZwNCygM5IPtNBlCUqHtAgI+GoqK3q7+Pwm8uFFw9vQPd1mYAx+qXYyFoBYlEwNF1YN2qjENiACtgRqORsNgQCA4wq5PrVo3gAAb4ViXJVYlh9W0lBPM/cOQYCKTAQjaZZ59vcj+RJiN2UXTkCltXkUIcaZyU631OfGdNJfvNZ5y/cI7E1PMdSXGyebvUpmq02RiX/ELvRQIMkdRy0iRsTI//mH6qLtYKqpCZEO11cpbgiuxWlqOIImPhly44d+zNQWxqM55WZnYJ6zDv0+IOYiZHsxWfFzsrsj1rSVBs0YrdnlXL7wFC/HqHS9dOi/Hd+Wi/ENHK0V+vUOeViiJ9ViJ0Lyn0X7+cl4h8bbvzmAoHvUmPiZunV+XO1eb0Y7MTufN+hNik+RspfMKV8ZSGqhOZPrdhWtIjTbs0OLYw7VSgjMuC+v0Jvi8V7GouDpRnkJ4WGvLE2F51GDky9MXYrVSGMlaDgYO4Hle6gRHloElBk197/qP10uDyaQUPw7JHZ7Xm7Ljxjz/2f+YwD1dbyiZLniZ1VKE+aet7VVrpjrmGPIQW7eX3PxORYltGWEkZ9iI2E5oPS1NfbsOUbiyMNS7sf5N0lT6A4hfpSKvBkBwpMQ+hVI37wUavw5e15ARzGVSayaDSZ1+pFPq/TqVAjVH81Agqa1SqrAqISsSv4s9algpl/pU6Y1ep8wx8FcG1c+3EbbR2yeWVsMcT+w+RBt3c4ySfGnp3kPizXgaY8WSpv/vlKDl46HokUTDl061q5rDq7Um8K5D+Drhp+y68KfGjdOTWN7V7Ukq1/Xozk56wFOQpLhyqTStZ6Er90B7WnjJHv3rzVd2sbPk9DWJ13oTHY/1Eb8X7ZsPJbZH1m0kt+NxtTUXuDhe/vJxDqHOU1S/VHtrBbbXrC6k80+aMYpje55IERw8x3XTWxmfvlnAzJ/l2PzHLOpBv1uyitNzpQddv3RFWph76kXKhVT7ZExovNihPniqx6U0YHlJx1ik+BM4Ep7lieZj77rbQJPZ/DnwrakF1yTA8y2VyxzJJZRfA8p8yzTc4cDv9JtOQ1pz0bRS/u+6Kl9gpre1tMiXqU2gMMlz2wShBk21J/B71XkdX8qSCbvlRt7dpW9G75GrtsKUex2SP9bjpTbqfCb/srilgHmw2c9I1MJs7T3bpuE1Uy6zvuSb7mxGi1W9YE4bEzGa1xx8tGpP4JYrTeMYnF0pOdn6j7nWMHcF+R91/x8z/KdTNuPL8LXVjf6duFEAwHv8US+8XjNeN9EI3v1GSMRpgIYU2Wi6loN3x/PIdL3Rskup8UzYxIdA+pjvIVcobJMERzmwT2yqXLxLJ/jU72e569yVX+Uen8hUrxo/HiMwX5uXrt1Tw3qpU5U8sCfnl0Cd5rxAlbSZMNlw++3Tg+mu5KseNDtYsl0ki9koYDBGyCMV88Q0j+q4OJrX8Ia5GjFvCOCk9JLrKoe9m3yJusCu46LjxHv7yifZHHweMJ9IkZ28SL7ZyM/NG5430adpac+0xNkmsqBnzedwART3j6OgLIRwq0hgdoNsGFmOsx06J1u6+zZzI2VyCsXjtMOww37qsjdhgPSkrMKUZWUp5ldpCes4fLCsJ2IyYcniJ9Qsz8YlduSYjkfEauHzTOb0EccAsvCXBucp11Gl7KKn8uBJb394q2XaKf0/ouHOjhn2Qxsk9EoBTRO3d/U1MzC5dOap0FRoxByazFX+plVcmnXonaoVaQ0kQFjywVcTR+0mABeFMAcpZ683YgI2WT93ckA+ssziDyuTDGJ5rPcAaXCBAZXIElJkMW2D9b8F1AxD7Da4CfwNXEx0LUyUB7I/9gR2gRAIKBWgwVkPJcSDgQozGg6fBcy5ub12ewAJxaH6Z0NhjELbu6t8fPgZqI2B/cZoBgALYzHC4kRnBjpQAG37wvk2qihQd3rl/W5qeetN54zdHtOLNvmdjtjU2hmACj9kXYj/kvsRMTNI4BLn2bRzrdvYo09AdaQhtyHlcX1/6YbF0qE0zzsPdt6fm7uyGTSVVjmmynnvx0eJm5APlQkwH6X1wT02Nhvc7q6nDifrPD756T873k7oY6NftZILc9gvWZ0dgWn5fGuslL9EEPS6TaP8DC12Zph0n3eb9uWMjAsPhfR8Grjd1xKW6bL9mbQ4XUL+VulyQxRLUUn/rYW5bblDcevHd3Ny4RGt6dd0d4bQLgUlHTiTE1ficVXg4vK6fTEBhD3+ysIryor+tdkS/6tJcsgmcvOEXlOwqJvYyirD7uSrGPeXiuTEP6uwVtOGrw7R891z6JR5fyuUqPZZhVRoVZcIo5bv+1Bkh/p+Uc6ISfq0zAkTl30Rg99Ng/d/2Qq0pVWrvMngIo9KDvpUrFvfnK2oXpXC6K8ZvYzqQAVte59Of9h1lfv/U7kZsPoeK7JSN+nRzu7rUwHpjaA5pN2472vv+ZcIFyzYs13sqj/0+m73FeQa6V4SYfLvPZwtWiMwJJvPcfheKVgnJWVzePEq/VXlO+mUUPCX6zsVTXpaWvKjLy9lvIri80bfS9+2ktbX3mZ+4uyGqRD0u577mwWRlQ0ObWRn6rNvjD+UDJyZdfTfGWJVB97P7XYW2LCTf6ig/z1Ee8WD7ZAY7XEz33vnxuzwZIgWl6k6LZ0ol7nXC3QtJvtPHt2pcLappMdY1K9Swne5kFi7OP5ATd+GIpg5x8Iqj5reCqsrIiNJ3BVWaInC4f9rHJrTs6iXbsIxFXsjp7n9KQf2f9UJrJpI/NEIsjJr7OymjkHAU7J+quQfnc82RjZcTCD2d7f7hjS+OX28QE9AvzLOiP0Hv0fKotL+yLvemnZGLmPV0r7f0pn3RYc/Q11csRAPNhxJFywpGGkghco/khKxoeP/pPTrDMZegzbO3Z6sGhcwr05wbUw+3hgTRe9QqYbUPnOcNtTnFJYaC7GXedZhOfmhgmYx/+V7xukvt0aTUh/bWv2p1bqg5aHVnygIlfXRUY6d2uPxGWVil59jN848bxuCRwyd539blrLw2tD6WaVWbpdPpfmNQ0cN2ZHfG1RkRywXWlmkI25CWdZoNMo19xReU0bixXeqjuUI0pQMLRuYTgZ6wSr4qsc1I8FVdoeHZDENfQfMN97tFsj0/Hle+ITLEcSMETxaclZyKoBnL9meN7yubGRN/vlfOJfaJfYC2mDzXbsnwxMD+QpllB1K85a8ZpzwnWhw9N27Q4Nb+hHleAGs8F26yIy1gH0d+NlfSo+47jruFs2ETaIDLjikK5bhf+QCEbCnam7lMFn+oL9TUWUJ0vcU5r2yKp8IpgAo/ttoU/azmYvUi9+P+0yhL38GDBYFn/+GfIBD5Q4fCYxkU+kOBVvxDi8SLI3GBWcf73C0aT2CYTdmtxVfOrEy9Ys2zQz0wI0vvFLUjtgPK2e/cwzH4UBACgsDh/6LwOoGfd5q/puK7wo6kQjAbZT/uT5/F0DwNS4Sj3UsdnM3mMP2ArW93valhu/kFtvGxzotxg002UI8AJqM3p2e9rc2e2sNlkSpXXCpdhB+wawqE5OR8sR6ha+vU4H4tmqz12af/4o5FaEDF3OlP1Q4dR5PkkdNsXg+PHb3yOqlbzqnLJLpok9U1/jJcIkFaoZyzdZB5pWVqw/bmLUJsvVZKgoNKRlNnI4dDzxzQnpc3LfVc6CtoXOpY9BzhzUZEuU9aBlbvahi44OUUe09o11JT6JeAiM7mmWCb9Z6VKe+/bHuvnDrkX+DPudkeSavSu//xi5rOnEercsWZqnifShxWi2vfjnRbunc4zyfk8zCdM4Xwe/X/AlBLAwQUAAIACAAVbjNUUdAgZnQBAABTAwAAJwAAAE1FVEEtSU5GL0FTaUNFdmlkZW5jZVJlY29yZE1hbmlmZXN0LnhtbNWTS1PCMBSF1/IrOmHp2CRFHmUoTKUijBaHhwrLSC8l2ibYpBT49bbig40LxpXbk3vP+e6ZSauzjSNjA4niUjiImgQZIBYy4CJ00MO0d9FAhtJMBCySAhwkJOq0Sy2m+KLpTnjXZ4IvQWkj9xGqWegOWmm9bmKcJtwErbgpkxATy6YNvKGmZdIyapfODh4THo5hCUkeCsbDeOAg/3rqXgyGPQwbHhRyAguZBGbOiPD3nsc0u39+gYX+Wfd5DNPdOqfUsNV4HTEu0MFU54iEmnqri+izlsfDXPFBr2RguFEoE65X8Td5lmVmVvngtgihmFzi/L48pKxWzKrW0OHcX+YJJnYxHygelj+YvwIfWZTCCbvtutoOfXrn1p5mNu9HULFvYq+XuPE+G7v+1aRWZ2nXHnq3u7nTwkchRVH4t6b+1KL1/1oU93czQr3qaD7qj6oNX44r/vVbulwO1eM57Hv121c66c67aX9wUoufb8f/oF16B1BLAwQUAAIACAARih5LiiH5RSEAAAAfAAAACAAAAG1pbWV0eXBlSywoyMlMTizJzM/TL8tL0UstKc7USyzOTNZN1a7KLAAAUEsBAhQAFAACAAgAMW0zVOEgdPYeAAAAHAAAAAoAAAAAAAAAAQAgAAAAAAAAAHRlc3QwMS50eHRQSwECFAAUAAIACAA0bTNUW3F9bx4AAAAcAAAACgAAAAAAAAABACAAAABGAAAAdGVzdDAyLnR4dFBLAQIUABQAAgAAAFRtM1QAAAAAAAAAAAAAAAAJAAAAAAAAAAAAEAAAAIwAAABNRVRBLUlORi9QSwECFAAUAAIACAAnbTNUZGVyo+EOAADfFgAAGwAAAAAAAAAAACAAAACzAAAATUVUQS1JTkYvZXZpZGVuY2VyZWNvcmQuZXJzUEsBAhQAFAACAAgAFW4zVFHQIGZ0AQAAUwMAACcAAAAAAAAAAQAgAAAAzQ8AAE1FVEEtSU5GL0FTaUNFdmlkZW5jZVJlY29yZE1hbmlmZXN0LnhtbFBLAQIUABQAAgAIABGKHkuKIflFIQAAAB8AAAAIAAAAAAAAAAEAIAAAAIYRAABtaW1ldHlwZVBLBQYAAAAABgAGAHsBAADNEQAAAAA=</dss:Base64Signature>
			</dss:SignatureObject>
		</esor:credential>
	</esor:credentialsSection>
</esor:XAIP>
